{
  "endedAt" : "2026-09-04T03:52:28Z",
  "id" : "53C67162-1E5E-448B-93AB-92686AFBB449",
  "machine" : {
    "logicalCoreCount" : 18,
    "memoryBytes" : 137438953472,
    "model" : "Mac17,7",
    "operatingSystem" : "Version 26.5.2 (Build 25F84)",
    "processor" : "Apple M5 Max",
    "toolVersion" : "0.1.0"
  },
  "mediaDurationSeconds" : 60,
  "sampleIntervalSeconds" : 1,
  "samples" : [
    {
      "cpuPercent" : 0,
      "diskReadBytes" : 0,
      "diskWrittenBytes" : 0,
      "elapsedSeconds" : 9.917e-06,
      "physicalFootprintBytes" : 320177328,
      "processes" : [
        {
          "cpuPercent" : 0,
          "process" : {
            "cpuTimeSeconds" : 0.860955039,
            "diskReadBytes" : 9814016,
            "diskWrittenBytes" : 222109696,
            "executablePath" : "/Applications/BetterShot.app/Contents/MacOS/BetterShot",
            "identity" : {
              "pid" : 45017,
              "startTimeNanoseconds" : 12497244443558
            },
            "name" : "BetterShot",
            "parentPID" : 1,
            "physicalFootprintBytes" : 320177328
          }
        }
      ],
      "systemCPUPercent" : 0,
      "systemMemoryDeltaBytes" : 0,
      "systemMemoryUsedBytes" : 92769681408
    },
    {
      "cpuPercent" : 0.3840051348019071,
      "diskReadBytes" : 0,
      "diskWrittenBytes" : 0,
      "elapsedSeconds" : 1.0406015,
      "physicalFootprintBytes" : 340231368,
      "processes" : [
        {
          "cpuPercent" : 0.3840051348019071,
          "process" : {
            "cpuTimeSeconds" : 0.864951443,
            "diskReadBytes" : 9814016,
            "diskWrittenBytes" : 222109696,
            "executablePath" : "/Applications/BetterShot.app/Contents/MacOS/BetterShot",
            "identity" : {
              "pid" : 45017,
              "startTimeNanoseconds" : 12497244443558
            },
            "name" : "BetterShot",
            "parentPID" : 1,
            "physicalFootprintBytes" : 340231368
          }
        }
      ],
      "systemCPUPercent" : 286.60570199031736,
      "systemMemoryDeltaBytes" : 37060608,
      "systemMemoryUsedBytes" : 92806742016
    },
    {
      "cpuPercent" : 0.7778019058532492,
      "diskReadBytes" : 0,
      "diskWrittenBytes" : 0,
      "elapsedSeconds" : 2.0405912920000002,
      "physicalFootprintBytes" : 338150600,
      "processes" : [
        {
          "cpuPercent" : 0.7778019058532492,
          "process" : {
            "cpuTimeSeconds" : 0.872729581,
            "diskReadBytes" : 9814016,
            "diskWrittenBytes" : 222109696,
            "executablePath" : "/Applications/BetterShot.app/Contents/MacOS/BetterShot",
            "identity" : {
              "pid" : 45017,
              "startTimeNanoseconds" : 12497244443558
            },
            "name" : "BetterShot",
            "parentPID" : 1,
            "physicalFootprintBytes" : 338150600
          }
        }
      ],
      "systemCPUPercent" : 258.73104997192587,
      "systemMemoryDeltaBytes" : 697106432,
      "systemMemoryUsedBytes" : 93466787840
    },
    {
      "cpuPercent" : 0.8957269042413991,
      "diskReadBytes" : 0,
      "diskWrittenBytes" : 0,
      "elapsedSeconds" : 3.040623959,
      "physicalFootprintBytes" : 339150024,
      "processes" : [
        {
          "cpuPercent" : 0.8957269042413991,
          "process" : {
            "cpuTimeSeconds" : 0.881687854,
            "diskReadBytes" : 9814016,
            "diskWrittenBytes" : 222109696,
            "executablePath" : "/Applications/BetterShot.app/Contents/MacOS/BetterShot",
            "identity" : {
              "pid" : 45017,
              "startTimeNanoseconds" : 12497244443558
            },
            "name" : "BetterShot",
            "parentPID" : 1,
            "physicalFootprintBytes" : 339150024
          }
        }
      ],
      "systemCPUPercent" : 228.89012827663132,
      "systemMemoryDeltaBytes" : 673988608,
      "systemMemoryUsedBytes" : 93443670016
    },
    {
      "cpuPercent" : 0.9492324474802687,
      "diskReadBytes" : 0,
      "diskWrittenBytes" : 0,
      "elapsedSeconds" : 4.040587959,
      "physicalFootprintBytes" : 343311560,
      "processes" : [
        {
          "cpuPercent" : 0.9492324474802687,
          "process" : {
            "cpuTimeSeconds" : 0.891178863,
            "diskReadBytes" : 9814016,
            "diskWrittenBytes" : 222109696,
            "executablePath" : "/Applications/BetterShot.app/Contents/MacOS/BetterShot",
            "identity" : {
              "pid" : 45017,
              "startTimeNanoseconds" : 12497244443558
            },
            "name" : "BetterShot",
            "parentPID" : 1,
            "physicalFootprintBytes" : 343311560
          }
        }
      ],
      "systemCPUPercent" : 261.8914381645215,
      "systemMemoryDeltaBytes" : 721551360,
      "systemMemoryUsedBytes" : 93491232768
    },
    {
      "cpuPercent" : 0.9269566428577382,
      "diskReadBytes" : 0,
      "diskWrittenBytes" : 0,
      "elapsedSeconds" : 5.04060225,
      "physicalFootprintBytes" : 343000264,
      "processes" : [
        {
          "cpuPercent" : 0.9269566428577382,
          "process" : {
            "cpuTimeSeconds" : 0.900448935,
            "diskReadBytes" : 9814016,
            "diskWrittenBytes" : 222109696,
            "executablePath" : "/Applications/BetterShot.app/Contents/MacOS/BetterShot",
            "identity" : {
              "pid" : 45017,
              "startTimeNanoseconds" : 12497244443558
            },
            "name" : "BetterShot",
            "parentPID" : 1,
            "physicalFootprintBytes" : 343000264
          }
        }
      ],
      "systemCPUPercent" : 251.83946488294316,
      "systemMemoryDeltaBytes" : 651198464,
      "systemMemoryUsedBytes" : 93420879872
    },
    {
      "cpuPercent" : 0.961345882295242,
      "diskReadBytes" : 0,
      "diskWrittenBytes" : 0,
      "elapsedSeconds" : 6.040616459,
      "physicalFootprintBytes" : 340853960,
      "processes" : [
        {
          "cpuPercent" : 0.961345882295242,
          "process" : {
            "cpuTimeSeconds" : 0.910062518,
            "diskReadBytes" : 9814016,
            "diskWrittenBytes" : 222109696,
            "executablePath" : "/Applications/BetterShot.app/Contents/MacOS/BetterShot",
            "identity" : {
              "pid" : 45017,
              "startTimeNanoseconds" : 12497244443558
            },
            "name" : "BetterShot",
            "parentPID" : 1,
            "physicalFootprintBytes" : 340853960
          }
        }
      ],
      "systemCPUPercent" : 203.3557046979866,
      "systemMemoryDeltaBytes" : 630718464,
      "systemMemoryUsedBytes" : 93400399872
    },
    {
      "cpuPercent" : 0.9447263211619548,
      "diskReadBytes" : 0,
      "diskWrittenBytes" : 0,
      "elapsedSeconds" : 7.040608209,
      "physicalFootprintBytes" : 347702472,
      "processes" : [
        {
          "cpuPercent" : 0.9447263211619548,
          "process" : {
            "cpuTimeSeconds" : 0.919509584,
            "diskReadBytes" : 9814016,
            "diskWrittenBytes" : 222109696,
            "executablePath" : "/Applications/BetterShot.app/Contents/MacOS/BetterShot",
            "identity" : {
              "pid" : 45017,
              "startTimeNanoseconds" : 12497244443558
            },
            "name" : "BetterShot",
            "parentPID" : 1,
            "physicalFootprintBytes" : 347702472
          }
        }
      ],
      "systemCPUPercent" : 225.25139664804473,
      "systemMemoryDeltaBytes" : 326893568,
      "systemMemoryUsedBytes" : 93096574976
    },
    {
      "cpuPercent" : 0.9009908834821756,
      "diskReadBytes" : 0,
      "diskWrittenBytes" : 0,
      "elapsedSeconds" : 8.040609125,
      "physicalFootprintBytes" : 350209224,
      "processes" : [
        {
          "cpuPercent" : 0.9009908834821756,
          "process" : {
            "cpuTimeSeconds" : 0.928519072,
            "diskReadBytes" : 9814016,
            "diskWrittenBytes" : 222109696,
            "executablePath" : "/Applications/BetterShot.app/Contents/MacOS/BetterShot",
            "identity" : {
              "pid" : 45017,
              "startTimeNanoseconds" : 12497244443558
            },
            "name" : "BetterShot",
            "parentPID" : 1,
            "physicalFootprintBytes" : 350209224
          }
        }
      ],
      "systemCPUPercent" : 208.92857142857144,
      "systemMemoryDeltaBytes" : 647413760,
      "systemMemoryUsedBytes" : 93417095168
    },
    {
      "cpuPercent" : 0.9416111593541263,
      "diskReadBytes" : 0,
      "diskWrittenBytes" : 0,
      "elapsedSeconds" : 9.040603375,
      "physicalFootprintBytes" : 339461320,
      "processes" : [
        {
          "cpuPercent" : 0.9416111593541263,
          "process" : {
            "cpuTimeSeconds" : 0.937935009,
            "diskReadBytes" : 9814016,
            "diskWrittenBytes" : 222109696,
            "executablePath" : "/Applications/BetterShot.app/Contents/MacOS/BetterShot",
            "identity" : {
              "pid" : 45017,
              "startTimeNanoseconds" : 12497244443558
            },
            "name" : "BetterShot",
            "parentPID" : 1,
            "physicalFootprintBytes" : 339461320
          }
        }
      ],
      "systemCPUPercent" : 211.2912241475685,
      "systemMemoryDeltaBytes" : 309493760,
      "systemMemoryUsedBytes" : 93079175168
    },
    {
      "cpuPercent" : 0.9375308536518461,
      "diskReadBytes" : 0,
      "diskWrittenBytes" : 0,
      "elapsedSeconds" : 10.04066225,
      "physicalFootprintBytes" : 339805384,
      "processes" : [
        {
          "cpuPercent" : 0.9375308536518461,
          "process" : {
            "cpuTimeSeconds" : 0.947313386,
            "diskReadBytes" : 9814016,
            "diskWrittenBytes" : 222109696,
            "executablePath" : "/Applications/BetterShot.app/Contents/MacOS/BetterShot",